Key,English(en),Spanish(es),French(fr),German(de),Italian(it),Portuguese(pt),Dutch(nl),Polish(pl),Russian(ru),Korean(ko),Japanese(ja),Chinese (Simplified)(zh-Hans)
001OpeningScene1Kellavar,"So, this is the famed capital of Sollus.","Entonces, esta es la famosa capital de Sollus.",C'est donc la célèbre capitale de Sollus.,Das ist also die berühmte Hauptstadt von Sollus.,"Quindi, questa è la famosa capitale di Sollus.","Então, esta é a famosa capital de Sollus.",Dus dit is de beroemde hoofdstad van Sollus.,Jest to s?ynna stolica Sollusa.,"????, ??? ?????????? ??????? ???????.",??? ??? ??? Sollus? ?????.,?????????????????????,????????Sollus???
001OpeningScene2Kellavar,"How long until it falls under my domain, I wonder?","¿Cuánto tiempo hasta que cae debajo de mi dominio, me pregunto?","Combien de temps jusqu'à ce qu'il tombe sous mon domaine, je me demande?","Wie lange dauert ich, bis es unter meine Domäne fällt,?","Quanto tempo prima che cada sotto il mio dominio, mi chiedo?","Quanto tempo até que se enquadre no meu domínio, eu me pergunto?","Hoe lang voordat het onder mijn domein valt, vraag ik me af?","Zastanawiam si?, jak d?ugo, a? wpadnie pod moj? domen??","?????????, ??? ????? ?? ??????? ??? ??? ??????",? ???? ?? ??? ??? ?????,????????????????????????????,???????????????
001OpeningScene3Kellavar,. . .,. . .,. . .,. . .,. . .,. . .,. . .,. . .,????? ????? ?????,. . .,? ? ?,? ? ?
001OpeningScene4Kellavar,. . .,. . .,. . .,. . .,. . .,. . .,. . .,. . .,????? ????? ?????,. . .,? ? ?,? ? ?
001OpeningScene5Kellavar,It appears the plane shift has sapped the remainder of my darkness.,Parece que el cambio de avión ha agotado el resto de mi oscuridad.,Il semble que le décalage d'avion ait sapé le reste de mon obscurité.,"Es scheint, dass die Flugzeugverschiebung den Rest meiner Dunkelheit geweckt hat.",Sembra che il turno del piano abbia assorbito il resto della mia oscurità.,Parece que o deslocamento do avião minou o restante da minha escuridão.,Het lijkt erop dat de vliegtuigverschuiving de rest van mijn duisternis heeft ondertand.,"Wygl?da na to, ?e zmiana samolotu os?abi?a pozosta?? cz??? mojej ciemno?ci.","??????, ??? ????? ????????? ????????? ?????????? ????? ???? ????.",??? ??? ? ??? ??? ??? ?? ? ????.,???????????????????????????,???????????????????
001OpeningScene6Kellavar,"No matter, I shall obtain more from The Source.","No importa, obtendré más de la fuente.","Peu importe, j'en obtiendrai plus de la source.","Egal, ich werde mehr von der Quelle erhalten.","Non importa, otterrò di più dalla fonte.","Não importa, vou obter mais da fonte.","Het maakt niet uit, ik zal meer van de bron halen.","Bez wzgl?du na to, ?e otrzymam wi?cej ze ?ród?a.","???????, ? ?????? ?????? ?? ?????????.","???, ?? ????? ? ?? ?? ?? ???.",?????????????????????,??????????????
